{
  "channels": [],
  "controllers": [
    {
      "name": "CPU 315-2 PN/DP",
      "order_no": "6ES7 315-2EH14-0AB0",
      "ref": "cpu:CPU 315-2 PN/DP",
      "type": "Simatic300"
    }
  ],
  "modules": [
    {
      "order_no": "6ES7 315-2EH14-0AB0",
      "rack": "SIMATIC 300(1)/R0",
      "ref": "SIMATIC 300(1)/0.2",
      "slot": 2,
      "type": "CPU 315-2 PN/DP"
    },
    {
      "rack": "SIMATIC 300(1)/R0",
      "ref": "SIMATIC 300(1)/0.4",
      "slot": 4,
      "type": "CP 343-1"
    },
    {
      "rack": "SIMATIC 300(1)/PROFINET-IO-System #1",
      "ref": "SIMATIC 300(1)/PROFINET-IO-System #1.1",
      "slot": 1,
      "type": "AKD-PN"
    }
  ],
  "networks": [
    {
      "address": "192.168.0.11/24",
      "interface": "ethernet",
      "ref": "SIMATIC 300(1)/AKD-PN #1/ethernet"
    },
    {
      "address": "10.1.2.20/16",
      "interface": "ethernet",
      "ref": "SIMATIC 300(1)/CP 343-1/ethernet"
    },
    {
      "address": "192.168.0.10/24",
      "interface": "ethernet",
      "ref": "SIMATIC 300(1)/CPU 315-2 PN/DP/ethernet"
    },
    {
      "address": "2",
      "interface": "mpi",
      "ref": "SIMATIC 300(1)/CPU 315-2 PN/DP/mpi"
    }
  ],
  "racks": [
    {
      "name": "AKD-PN (device 1 on PROFINET-IO-System)",
      "ref": "SIMATIC 300(1)/PROFINET-IO-System #1"
    },
    {
      "name": "SIMATIC 300(1) rack 0",
      "ref": "SIMATIC 300(1)/R0"
    }
  ]
}
